,Bleu_1,Bleu_2,Bleu_3,Bleu_4,CIDEr,METEOR,ROUGE_L,cand,ref
93,0.37499999998125005,0.1698415551131429,9.122238855837814e-07,2.1282647338131132e-09,0.3920171317436675,0.1654980953108218,0.2,heart size is mildly enlarged there is a calcified granuloma in the right lower lobe xxxx xxxx atelectasis there is a small calcified granuloma no acute infiltrate or effusion is seen in the right hemidiaphragm no pneumothorax xxxx xxxx atelectasis,[u'the lungs are clear there is no pleural effusion or pneumothorax there has been a xxxx xxxx sternotomy the heart is not significantly enlarged there are atherosclerotic changes of the aorta arthritic changes of the skeletal structures are noted .']
94,0.12983980275111615,1.7278128166864574e-09,4.183462500904397e-12,2.0943356285497777e-13,0.0005386020723205606,0.07278241091736164,0.18496058217101274,the lungs and pleural spaces show no acute abnormality heart size and pulmonary vascularity within normal limits,[u'there may be a subtle airspace opacity in the right base near the midclavicular line there is no pleural effusion or pneumothorax the heart and mediastinum are normal the skeletal structures are normal .']
95,0.31484937062167295,0.15175714591050596,9.591555716406245e-07,2.440935651145466e-09,0.23060825607245827,0.13038801956661325,0.30827542640555905,the cardiac silhouette is normal in size and contour the lungs are clear without evidence of infiltrate there is no pneumothorax or effusion,[u'the cardiomediastinal silhouette is within normal limits for appearance no focal areas of pulmonary consolidation no pneumothorax no pleural effusion mild degenerative changes of the thoracic spine .']
96,0.3859649122739305,0.21964884254960187,0.12060770349806166,0.07549754786482096,0.38832372868467224,0.16817667611753426,0.21727515583259127,there is hyperinflation of the lungs consistent with emphysema there is a small calcified granuloma in the right lung base the lungs are clear bilaterally specifically no evidence of focal consolidation pneumothorax or pleural effusion cardio mediastinal silhouette is unremarkable visualized of the thorax with flattening of the thorax and without acute abnormality no acute cardiopulmonary abnormality,[u'heart size and mediastinal contours are within normal limits diffuse bilateral calcified sequelae of prior granulomatous infection no pulmonary vascular congestion no xxxx edema no focal consolidation there is no visible pleural effusion or pneumothorax there is mild anterior wedging of a lower thoracic vertebral body approximately t level no acute cardiopulmonary abnormality .']
97,0.08110244987505275,0.04826561176342571,3.2923450039443647e-07,8.748425665697198e-10,3.523479798099377e-05,0.06349296890810961,0.18895198760970572,heart size within normal limits no focal airspace disease no pneumothorax or effusions no acute bony abnormalities,[u'the lungs are clear bilaterally specifically no evidence of focal consolidation pneumothorax or pleural effusion left basilar subsegmental atelectasis versus scar noted cardio mediastinal silhouette is unremarkable visualized osseous structures of the thorax are without acute abnormality no acute cardiopulmonary abnormality .']
98,0.45161290321123837,0.3246172270214718,0.24404413420700813,0.19865160852025462,0.6677541343887796,0.25608500123311567,0.44475602916432977,heart size and mediastinal contours appear within normal limits pulmonary vascularity is within normal limits no focal consolidation suspicious pulmonary opacity pneumothorax or definite pleural effusion visualized osseous structures appear intact,[u'the heart is normal in size the pulmonary vascularity is within normal limits in appearance no pneumothorax or pleural effusion patchy right lower lung opacification is noted .']
99,0.3947368420948754,0.20657747505062754,0.10583300875240854,1.356590733316526e-05,0.4203209375372534,0.14497597785572036,0.19641214351425945,there is stable mild cardiomegaly with atherosclerotic calcifications of the aorta there are no focal areas of consolidation no pneumothorax no pleural effusions the heart and pulmonary xxxx are grossly normal bony structures and soft tissues are unremarkable,[u'the cardiomediastinal silhouette and pulmonary vasculature are within normal limits in size there is minimal xxxx opacity in the lung bases the lungs are otherwise grossly clear there are no acute bony findings .']
100,0.07142857142346946,2.344036154518608e-09,7.707540023952373e-12,4.516881220590475e-13,0.09881483262770033,0.07666601376407348,0.08176943699731902,the heart is normal in size the mediastinum is unremarkable the lungs are clear,[u'cardiomegaly no pneumothorax or pleural effusion clear lung xxxx bilaterally .']
101,0.42857142854081637,0.2567762954875012,0.1764586168093624,2.6584835764514756e-05,0.6171802531740949,0.280855168949918,0.24530831099195713,the heart is normal in size the mediastinum is unremarkable the lungs are clear,[u'both lungs are clear and expanded heart and mediastinum normal .']
102,0.1598056445479651,0.09855041940888307,0.07037440363940187,0.05043315855862806,9.911974119084918e-12,0.10235615533257257,0.2641454965357968,the cardiomediastinal silhouette is normal in size and contour the lungs are clear without evidence of focal infiltrate or effusion there is no pneumothorax the visualized bony structures reveal no acute abnormalities,[u'the heart and mediastinum are unremarkable there is a calcified granuloma within the left upper lobe the lungs are clear without infiltrate there is no effusion or pneumothorax there are acute mild anterior xxxx deformities identified at ll there is retropulsion of the posterior vertebral body of l a ct of the lumbar spine was already ordered at the time of this dictation no acute cardiopulmonary disease acute anterior xxxx deformities at ll .']
103,0.47826086954442354,0.2948839122966819,0.16058104813304025,2.1331098310936743e-05,0.3893352703490238,0.2664557029530988,0.3391580619539316,lungs are clear bilaterally cardiac and mediastinal silhouettes are normal pulmonary vasculature is normal no pneumothorax or pleural effusion no acute bony abnormality,[u'lungs are clear no focal consolidation effusion or pneumothorax heart and mediastinal contours are normal osseous structures intact .']
104,0.21428571427806126,0.17817416126846844,0.1346631279273663,0.09941490945225864,0.08420689876386568,0.18456175287758195,0.2789634146341463,xxxx sternotomy xxxx and mediastinal contours are within normal limits heart size within normal limits no focal airspace consolidation no pleural effusions or pneumothorax no acute bony abnormalities,[u'the lungs are clear the cardiomediastinal silhouette is within normal limits no pleural effusion is identified .']
105,0.30769230768639055,0.15534712747310678,0.07844142656278798,9.962310935752864e-06,0.026070325770779237,0.14191442613231176,0.1781021897810219,there is a calcified granuloma in the left lower lobe no focal consolidation there is a calcified granuloma in the right lower lobe there is no pneumothorax or large pleural effusion the heart and pulmonary xxxx are normal in the mediastinum are present there is a small nodule in the right midlung,[u'xxxx xxxx and lateral chest examination was obtained the heart silhouette and mediastinal contours are not enlarged there is elevated right hemidiaphragm and evidence of right upper lobectomy lungs demonstrate no acute findings there is no effusion or pneumothorax .']
106,0.1731900342882929,0.09832929168979035,0.05213299603984173,6.837489455326464e-06,6.8394538616939255e-06,0.11080204660051676,0.21089023336214346,the lungs are clear there is no focal airspace consolidation no pleural effusion or pneumothorax heart size and mediastinal contour are normal,[u'the pulmonary nodules and masses masses on previous exam are smaller and not definitely seen the lungs are otherwise clear heart size normal no pneumothorax there is a right chest xxxx with tip projecting over the lower svc interval decrease in size of numerous pulmonary nodules and masses .']
107,0.02871630962970636,0.01126346331998792,8.467861739702168e-08,2.372858294804411e-10,3.259142248626802e-11,0.05024983912299256,0.15954664341761116,the heart is normal in size the mediastinum is unremarkable the lungs are clear,[u'size is normal limits cardiomediastinal silhouette has normal contour there is a vague opacity in the right infrahilar region there is also a mm well circumscribed nodule in the right upper lung xxxx it is not well visualized on lateral view right perihilar lung nodule recommend ct thorax with contrast to further assess .']
108,0.39981287844295854,0.2540766500460078,0.15555394524000477,2.212006039782957e-05,0.6111833800173637,0.20046511174623724,0.471953578336557,the heart is normal in size the mediastinum is unremarkable the lungs are clear,[u'heart size is normal lungs are clear no edema or effusions heart size is normal lungs are clear .']
109,0.6956521738827978,0.5334650693455433,0.37845788435990785,0.3002866207756925,2.198772852737036,0.39974293309095077,0.6123552123552123,heart size mediastinal contour and pulmonary vascularity are normal lungs are clear no pleural effusion or pneumothorax there is no acute cardiopulmonary findings,[u'heart size and mediastinal contour are normal pulmonary vascularity is normal lungs are clear no pleural effusions or pneumothoraces .']
110,0.327048415653852,0.31666326680714035,0.30517796506068,0.2923371807377938,0.027344539649236232,0.3156538641050088,0.6025566531086578,the lungs and pleural spaces show no acute abnormality heart size and pulmonary vascularity within normal limits,[u'the lungs and pleural spaces show no acute abnormality lungs are hyperexpanded minimal xxxx scarring in both lower lobes heart size and pulmonary vascularity within normal limits stable mild tortuosity of the descending thoracic aorta .']
111,0.21779681839415777,0.057080581698556565,3.690529352505379e-07,9.458796276014685e-10,0.00011008527346105316,0.07999076254263406,0.1660993873383254,the heart is mildly enlarged the aorta is tortuous the pulmonary vasculature is within normal limits there is no pneumothorax or pleural effusion there are no focal areas of consolidation no acute bony abnormalities,[u'heart size is enlarged cardiomediastinal contours are unchanged since previous exam there is blunting of the right costophrenic xxxx xxxx old pleural scar lungs are otherwise clear bilaterally a left upper lobe granuloma appears unchanged there is kyphosis of the thoracic spine with anterior osteophyte formations aortic ectasia is seen in the ascending aorta and the xxxx .']
112,0.1534413536636628,0.07185549737557781,0.035653896345098315,4.516029655821347e-06,8.671980413008263e-11,0.14195737428541255,0.12344013490725128,there are mild degenerative changes of the spine no focal airspace consolidation no pneumothorax or pleural effusion heart size and pulmonary vascularity within normal limits,[u'the heart size is normal the mediastinal contour is within normal limits low lung volumes and bronchovascular crowding mild bibasilar opacities xxxx atelectasis the lungs are free of any focal infiltrates there are no nodules or masses no visible pneumothorax no visible pleural fluid stable degenerative change throughout the thoracic spine stable thoracolumbar retrolisthesis there is no visible free intraperitoneal air under the diaphragm .']
113,0.31249999999348965,0.1630820182599269,0.08330762903217113,1.0646588104484678e-05,0.04420604990908923,0.14754056016094963,0.28110599078341014,the heart size is normal the mediastinal contour is within normal limits the lungs are free of any focal infiltrates there are no nodules or masses no visible pneumothorax no visible pleural fluid the xxxx are grossly normal there is no visible free intraperitoneal air under the diaphragm,[u'heart size mediastinal contour and pulmonary vascularity are within normal limits no focal consolidation suspicious pulmonary opacity large pleural effusion or pneumothorax is identified calcified left coronary arteries noted visualized osseous structures appear intact no acute cardiopulmonary abnormality .']
114,0.0138999603814981,1.8622169654109387e-10,4.542447185090854e-13,2.292803470865216e-14,9.76374486442224e-16,0.0412330653220365,0.09450038729666925,the heart is normal in size the mediastinum is unremarkable the lungs are clear,[u'mediastinal contours are within normal limits heart size is within normal limits no focal consolidation pneumothorax or pleural effusion no bony abnormality vague density in right mid lung xxxx related to scapular tip and superimposed ribs not visualized on lateral exam vague density in right xxxx xxxx related to scapular tip and superimposed ribs consider oblique images to exclude true nodule .']
115,0.2935875900378124,0.2487622098363877,0.2196550033018255,0.190609162213453,0.07094726979783882,0.20982173661021078,0.4813486370157819,the heart is normal in size the mediastinum is unremarkable the lungs are clear,[u'the heart is normal in size and contour there is no mediastinal widening the lungs are clear bilaterally no large pleural effusion or pneumothorax the xxxx are intact .']
116,0.1038740935569613,0.057618980078605955,0.03859185993253305,5.739947521213666e-06,0.000161518897425685,0.08710662227736178,0.2594167679222357,the heart is normal in size the mediastinum is unremarkable the lungs are clear,[u'the cardiomediastinal silhouette is within normal limits for size and contour the lungs are normally inflated without evidence of focal airspace disease pleural effusion or pneumothorax osseous structures are within normal limits for patient age .']
117,0.5305700387268814,0.32453788317670373,0.1637492765038803,2.0951035071164526e-05,0.7616119680433552,0.25596764556050555,0.2873485868102288,the lungs appear clear there is no focal airspace consolidation no pleural effusions or pneumothoraces heart size and mediastinal contour are normal,[u'the heart size and pulmonary vascularity appear within normal limits the lungs are free of focal airspace disease no pleural effusion or pneumothorax is seen .']
118,0.31531982293388633,0.13246082044585147,1.0122997800407697e-06,2.843984167102171e-09,0.26466396028419703,0.1588952392337079,0.26895943562610225,heart size normal lungs are clear xxxx are normal no pneumonia effusions edema pneumothorax adenopathy nodules or masses,[u'no focal areas of consolidation no pneumothorax heart size within normal limits no pleural effusions osseous structures intact .']
119,0.14634146341106488,0.060485837889419726,4.543748293474347e-07,1.2534724690400046e-09,0.014870849805103448,0.06347019400561213,0.10045286125977768,the cardiomediastinal silhouette is normal in size and contour the lungs are clear without evidence of focal infiltrate or effusion there is no pneumothorax the visualized bony structures reveal no acute abnormalities lateral view reveals degenerative changes of the thoracic spine,[u'negative for cardiac enlargement negative for vascular congestion bilateral granulomas are seen scattered throughout the lungs negative for pneumothorax negative for focal air space consolidation some minimal streaky opacity at the bilateral bases xxxx relates to subsegmental atelectasis .']
120,0.4505870379125154,0.17332038993685459,1.0126547458071463e-06,2.470955242365044e-09,0.5968286934093293,0.21409750852444406,0.26507332971211295,heart size is enlarged the mediastinal contour is normal pulmonary vasculature is normal there is no focal consolidation pleural effusion or pneumothorax identified the visualized osseous structures are intact,[u'the cardiomediastinal silhouette and pulmonary vasculature are within normal limits in size the lungs are clear of focal airspace disease pneumothorax or pleural effusion there are no acute bony findings .']
121,0.4208139601737799,0.30618713056378644,0.23701687103215083,0.16102833097432323,0.221277313046094,0.2339890384161976,0.42957746478873243,there is no focal consolidation pleural effusion or pneumothorax normal heart size bony thorax and soft tissues unremarkable,[u'the lungs are clear there is no pleural effusion or pneumothorax the heart and mediastinum are normal the skeletal structures are normal .']
122,0.645648526347186,0.6456485263458409,0.6456485263443678,0.6456485263427443,3.036595602719347,0.47483010015317084,0.7947882736156351,cardiac and mediastinal contours are within normal limits the lungs are clear bony structures are intact,[u'cardiac and mediastinal contours are within normal limits the lungs are clear bony structures are intact small hiatal hernia no acute findings .']
123,0.2779080130958466,0.2353851840259347,0.18468277073821115,0.13916927288847572,0.0033448158884524697,0.20371897516405638,0.4396396396396396,heart size and mediastinal contours are within normal limits no focal airspace consolidation no pneumothorax or pleural effusion degenerative changes of the thoracic spine,[u'xxxx sternotomy xxxx remain in xxxx the cardiomediastinal silhouette is within normal limits for appearance the thoracic aorta is tortuous no focal areas of pulmonary consolidation no pneumothorax no pleural effusion moderate degenerative changes of the thoracic spine no acute displaced rib fractures identified .']
124,0.562499999982422,0.3563932224723017,0.1617754212639444,1.9547215687428063e-05,0.7387583502782005,0.30268744323464497,0.5622119815668203,the heart size and pulmonary vascularity appear within normal limits the lungs are free of focal airspace disease no pleural effusion or pneumothorax is seen degenerative changes are present in the spine,[u'heart size and mediastinal contour are normal pulmonary vascularity is normal lungs are clear no pleural effusions or pneumothoraces degenerative changes in the thoracic spine .']
125,0.4090909090723141,0.3418817293630038,0.28593057214639195,0.22272273120930888,0.22009622490283678,0.33036286257423647,0.47937131630648333,the lungs are clear there is no pneumothorax or pleural effusion the heart and mediastinum are normal the skeletal structures are intact,[u'normal cardiomediastinal contours lungs are clear bilaterally no pneumothorax or pleural effusion .']
126,0.20833333332899312,0.1331559103200233,0.07277591728600324,9.620278342821096e-06,4.661237828372319e-08,0.20342518185863645,0.31551724137931036,the heart size is normal the mediastinal contour is within normal limits the lungs are free of any focal infiltrates there are no nodules or masses no visible pneumothorax no visible pleural fluid the xxxx are grossly normal there is no visible free intraperitoneal air under the diaphragm,[u'the heart is normal in size the mediastinum is unremarkable the lungs are clear .']
127,0.15806680329057837,0.11440035325597549,0.07238450553361934,1.037107640969819e-05,0.013359498511776572,0.09160788038784323,0.20631341600901915,heart size and mediastinal contours appear within normal limits no focal airspace consolidation no pleural effusion or pneumothorax no acute bony abnormalities,[u'lungs are clear bilaterally there is no focal consolidation pleural effusion or pneumothoraces there is widening adjacent to the right paratracheal stripe most xxxx represents the svc with rotated position xxxx are unremarkable .']
128,0.15163266491299512,2.2001179427024578e-09,5.463748830552615e-12,2.76197030061825e-13,0.007145833294836718,0.06549687156925144,0.11582278481012659,the heart and lungs have xxxx xxxx in the interval both lungs are clear and expanded heart and mediastinum normal,[u'cardiac and mediastinal xxxx appear normal no visible pneumothorax focal airspace opacity or pleural effusion is seen no visible free air under the diaphragm the osseous structures appear intact .']
129,0.28070768675355345,0.16443272028658343,0.087538926323232,1.1445866944746343e-05,0.1215203647159982,0.09154081968346112,0.2299958106409719,stable cardiomegaly and mediastinal contours stable calcified xxxx scarring in the left lower lobe there is a patchy airspace disease in the right lower lobe no acute infiltrate is seen no pleural effusion or pneumothorax,[u'the heart is normal in size the mediastinum is stable the aorta is atherosclerotic there are emphysematous changes with increased interstitial markings particularly in the periphery and lung bases the lungs are clear of focal infiltrates there is no pleural effusion .']
130,0.39999999998666674,0.2626128657105405,0.19477433953587747,0.12861981015776489,0.25542316988241287,0.23650284540144717,0.3865652724968314,the lungs are clear bilaterally specifically no evidence of focal consolidation pneumothorax or pleural effusion cardio mediastinal silhouette is unremarkable visualized osseous structures of the thorax are without acute abnormality,[u'lungs are clear there is no pneumothorax or pleural effusion the heart and mediastinum are within normal limits bony structures are intact .']
131,0.06833711941680269,1.2947573424990184e-09,3.5450278883859095e-12,1.8957559732952675e-13,0.001211363072018672,0.032764505119453925,0.08531468531468532,the heart is normal in size the mediastinum is unremarkable the lungs are clear,[u'cardiac silhouette and mediastinal contours are within this there is no opacity there is no pneumothorax no large pleural effusion hyperlucent right apex with hyperinflation consistent with emphysematous changes .']
132,0.2709477576022297,0.17354545680983763,0.10462666847814521,0.06876935323277232,0.03529114998986071,0.10727751927785825,0.2517193947730399,the heart size is normal the mediastinal contour is within normal limits there is a calcified granuloma within the right lung base no focal consolidation or pneumothorax identified there are degenerative changes of the thoracic spine no acute bony abnormalities,[u'heart size normal tortuous aorta calcified hilar lymph xxxx xxxx sequela of prior granulomatous disease hyperinflated lungs the otherwise lungs are clear the bilateral apices are partially excluded from the xxxxofview there is the interval fixation of the right humeral fracture xxxx appears grossly intact osteopenia exaggerated kyphosis of the thoracic spine .']
133,0.2340425531865098,0.12354612406992554,0.06973999503999065,9.370187147557456e-06,1.0204901655847456e-05,0.23521793950503983,0.16094986807387862,the heart size is normal the mediastinal contour is within normal limits there are small calcified granuloma in the right lung base the lungs are otherwise grossly clear no pneumothorax or pleural effusion there is ageindeterminate mild degenerative changes of the thoracic spine no acute cardiopulmonary abnormality,[u'the lungs are clear the heart and pulmonary xxxx are normal pleural spaces are clear mediastinal contours are normal .']
134,0.06154701125825404,0.03637039636191577,0.019542111721400097,2.5801937528055754e-06,1.800488262863732e-15,0.07712560810680644,0.1986970684039088,the cardiomediastinal silhouette is normal in size and contour no focal consolidation pneumothorax or large pleural effusion negative for acute bone abnormality,[u'the xxxx examination consists of frontal and lateral radiographs of the chest cardiac silhouette is at top limits of normal aortic and mediastinal contours are within normal limits pulmonary vascularity is within normal limits no focal consolidation pleural effusion or pneumothorax identified partially visualized orif xxxx involving the left proximal humerus deformity of the left distal clavicle compatible with remote xxxx no displaced rib fractures on this chest examination .']
135,0.4790574204274358,0.30875412985812406,0.14870145098764095,1.853952544967941e-05,0.3982915221468648,0.2372366274544586,0.4087102177554439,heart size within normal limits stable mediastinal and hilar contours no focal alveolar consolidation no definite pleural effusion seen no typical findings of pulmonary edema no pneumothorax,[u'heart size upper normal but stable mediastinal contours within normal limits minimal right middle lobe atelectasis no focal airspace consolidation pleural effusion or pneumothorax degenerative endplate changes of the spine .']
136,0.4487374208942605,0.247522371544453,0.15132888540178016,0.10040760063075643,0.23352071529384355,0.21302857416710744,0.2929875120076849,the cardiomediastinal silhouette and pulmonary vasculature are within normal limits in size the lungs are clear of focal airspace disease pneumothorax or pleural effusion there are no acute bony findings,[u'the heart pulmonary xxxx and mediastinum are within normal limits there is no pleural effusion or pneumothorax there is no focal air space opacity to suggest a pneumonia there are mild degenerative changes of the spine .']
137,0.17952790605159136,0.15020382264055265,0.13365527978597966,0.11892530561128566,6.8098462482962714e-06,0.139954821751317,0.36731182795698925,the heart is normal in size the mediastinum is unremarkable the lungs are hypoinflated but clear no acute infiltrate is seen,[u'the heart is normal in size the mediastinum is stable atherosclerotic calcifications of the aorta there is again a pleural based density in the right lung base xxxx related to subpleural fat the appearance is stable from multiple previous studies the lungs are clear there is no pleural effusion .']
138,0.1335524060018074,1.4609077849965435e-09,3.330687351545927e-12,1.6253112454086663e-13,0.00021044460232770215,0.08310249307479224,0.2223572296476306,the heart is normal in size the mediastinum is unremarkable the lungs are clear,[u'lumbar and are low no infiltrates heart size normal a large hiatal hernia is present an ageindeterminate xxxx fracture is present in the lower thoracic vertebra scoliosis is present in the thoracic and thoracolumbar spine .']
