,Bleu_1,Bleu_2,Bleu_3,Bleu_4,CIDEr,METEOR,ROUGE_L,cand,ref
45,0.1790870728603726,0.08150780901694768,5.036926768381384e-07,1.2639981826777457e-09,0.0015405177801315604,0.10594754658682236,0.17407256420709338,heart size mediastinal contour and pulmonary vascularity are within normal limits no focal consolidation suspicious pulmonary opacity large pleural effusion or pneumothorax is identified visualized osseous structures appear intact,[u'frontal and lateral views of the chest show normal size and configuration of the cardiac silhouette normal mediastinal contour pulmonary xxxx and vasculature central airways and lung volumes and scattered calcified granulomas left greater than right basilar opacity probable atelectasis andor scarring no pleural effusion basilar atelectasis .']
46,0.3333333333263889,0.2062842492474154,0.09743719400741022,1.1974032926863441e-05,0.3613460750982661,0.14890586956354354,0.1730496453900709,there is stable bilateral emphysematous changes in the left lower lobe changes of the left upper lobe and pleural effusion there is no pneumothorax or focal airspace disease the xxxx are intact the right apex are present on the prior study heart size normal pulmonary vascularity are noted,[u'heart size and mediastinal contours are stable atherosclerotic calcifications of the aorta moderate severe hyperexpansion of the lungs and decreased peripheral vascular markings consistent with emphysema stable biapical pleuralparenchymal scarring scattered granulomas no abnormal airspace consolidation no pneumothorax or pleural effusion stable emphysematous changes .']
47,0.0813139319318571,1.9165877557879354e-09,5.715235527885482e-12,3.2268949768114413e-13,0.0058850059797026935,0.05510907003444317,0.13062098501070665,both lungs are clear and expanded heart and mediastinum normal,[u'heart size within normal limits no focal airspace disease no pleural effusion no pneumothorax no acute cardiopulmonary findings .']
48,0.17483630695964952,0.14053988416690585,0.11724091412042745,0.09202559616555683,0.14921934826261116,0.0869539127418897,0.2512355848434926,the heart is normal in size the mediastinum is unremarkable the lungs are clear,[u'the cardiomediastinal silhouette is normal in size and contour no focal consolidation pneumothorax or large pleural effusion negative for acute displaced rib fracture .']
49,0.08116318371858477,0.06432944625965176,0.054656029969463005,0.04531449772004243,2.0461835309120956e-07,0.12360165339210959,0.32859941234084233,the heart is normal in size the mediastinum is unremarkable the lungs are clear,[u'the heart is normal in size and contour there is a focal area of scarring or xxxx atelectasis identified in the lingula the lungs are otherwise clear without focal infiltrate there is no pneumothorax or effusion focal area of xxxx scarring or atelectasis within the lingula .']
50,0.16435170150135142,0.08550659932801054,0.04060826976282122,5.013755544228425e-06,1.6379843892093245e-11,0.09654350841780877,0.19741100323624597,heart size and mediastinal contour are normal there is a mm nodular opacity in the left upper lobe xxxx representing atelectasis there is no evidence of pneumothorax or pleural effusion there are no acute bony findings,[u'heart size is normal prior calcified granulomatous disease on the lateral view in the anterior costophrenic xxxx there is a x cm nodular density which seems to be present previously but is more nodular in appearance on this examination no pleural effusion or pneumothorax endplate degenerative changes of the thoracolumbar spine and mild scoliosis are unchanged cm nodular density in the anterior costophrenic xxxx on the lateral view which could represent overlapping shadows or actual pulmonary nodule .']
51,0.3593619902141449,0.20539628909774735,0.11957828338223789,0.07742357900641046,0.010373656725451813,0.17031346661327448,0.29975429975429974,the lungs are clear bilaterally specifically no evidence of focal consolidation pneumothorax or pleural effusion cardio mediastinal silhouette is unremarkable visualized osseous structures of the thorax are without acute abnormality,[u'normal heart size and hilar vascular markings evidence of prior granulomatous disease the lungs are clear without focal area of consolidation pleural effusion or pneumothorax there are no acute osseous abnormalities present mild degenerative changes of the thoracic spine the soft tissues are within normal limits .']
52,0.3128779836969666,0.1983226193488059,0.12107630010356844,1.716299647991624e-05,0.27924068319226575,0.18650578318856545,0.35494596841230264,heart size is normal no focal airspace disease pneumothorax or effusion no acute bony abnormalities,[u'the heart is normal in size and contour the lungs are clear without evidence of infiltrate there is no pneumothorax or effusion .']
53,0.07936507936381962,0.03577823256118519,2.7582649247152607e-07,7.690227185963754e-10,3.7651899424355516e-08,0.06447514795304052,0.0671067106710671,there is a moderate sized of the left lower lobe airspace disease is seen on the lateral view there is a cm opacity in the left lower lobe is present on the lateral view there is no pneumothorax or pleural effusion the heart size and pulmonary vascularity appear within normal limits there are diffuse degenerative changes of the spine no focal airspace disease,[u'normal heart size tortuous calcified aorta scattered granulomas no lobar pneumonia probable xxxx post your recess effusions kyphotic degenerated osteopenic thoracic spine probable xxxx posterior recess effusions with mild basilar atelectasis .']
54,0.9682566770814425,0.9682566770809219,0.9682566770803774,0.968256677079807,9.741136742839346,0.6911772449513779,0.981318111053451,heart size and mediastinal contours appear within normal limits pulmonary vascularity is within normal limits no focal consolidation suspicious pulmonary opacity pneumothorax or definite pleural effusion visualized osseous structures appear intact,[u'heart size and mediastinal contours appear within normal limits pulmonary vascularity is within normal limits no focal consolidation suspicious pulmonary opacity pneumothorax or definite pleural effusion visualized osseous structures appear intact .']
55,0.36787944111888815,0.36787944111787746,0.3678794411167545,0.3678794411154963,0.31145480277722504,0.338126567334816,0.6288659793814433,the heart is normal in size the mediastinum is unremarkable the lungs are clear,[u'the heart is normal in size the mediastinum is unremarkable the lungs are clear there is no pleural effusion or pneumothorax old rightsided rib deformities are noted .']
56,0.08379940434106502,0.07778184971208885,0.07453279910403883,0.0717451349521899,5.216177840166836e-06,0.11861453108476183,0.3154084798345398,the heart is normal in size the mediastinum is unremarkable the lungs are clear,[u'the heart is normal in size the mediastinum is stable the previously visualized bilateral pneumothoraces have resolved right chest wall surgical xxxx have been removed there is improved aeration in the lung bases with mild residual xxxx opacities compatible with scarring or atelectasis .']
57,0.12164915633420853,0.058263555905858314,0.029032633457014234,3.675462257811706e-06,4.018100561193528e-16,0.09138559250413476,0.13132400430570507,the heart size and pulmonary vascularity appear within normal limits the lungs are free of focal airspace disease no pleural effusion or pneumothorax is seen degenerative changes are present in the spine,[u'there is right basilar opacity with associated blunting of the costophrenic xxxx seen on lateral view in addition there is a interface along the left hemidiaphragm this may represent attenuation artifact however further evaluation with right lateral decubitus views would better evaluate there is no pneumothorax the xxxx lungs are clear cardiac silhouette and mediastinal contours are within normal limits right basilar opacity with associated blunting of costophrenic xxxx on lateral view may represent small pleural effusion atelectasis andor consolidation .']
58,0.9394130626960491,0.939413062694092,0.9394130626919486,0.9394130626895865,9.59117455066788,0.6410511905542807,0.9644268774703558,cardiac and mediastinal contours are within normal limits the lungs are clear bony structures are intact,[u'cardiac and mediastinal contours are within normal limits the lungs are clear bony structures are intact .']
59,0.6068056788259172,0.48290956728397244,0.3749628373732181,0.26677594562597995,1.0654353716081228,0.3579022512178252,0.4100074682598955,lungs are clear no pneumothorax or pleural effusion normal heart and mediastinal contours normal pulmonary vasculature bony thorax intact,[u'lungs are clear bilaterally cardiac and mediastinal silhouettes are normal pulmonary vasculature is normal no pneumothorax or pleural effusion no acute bony abnormality .']
60,0.6065306596259863,0.5827358085109444,0.5736793313025969,0.5680243075075805,2.417523221378416,0.3914284253208932,0.7721518987341772,the heart is normal in size the mediastinum is unremarkable the lungs are clear,[u'the heart is normal in size the mediastinum is unremarkable the lungs are grossly clear bilateral breast prostheses are noted .']
61,0.11976946337703094,0.03930415333363483,2.7843463781397857e-07,7.573782159531718e-10,4.274534578059597e-05,0.08445522356154347,0.24344355758266817,the heart is normal in size the mediastinum is unremarkable the lungs are clear,[u'the heart size is within normal limits trachea is midline no pleural effusions or pneumothorax cardiomediastinal contours are normal there is focal consolidation in the posterior segment of the right lower lobe no bony or soft tissue abnormalities .']
62,0.28941252212708796,0.16414849017465744,0.11574853238475646,0.08850605211565796,0.004687322120035287,0.10920966300151565,0.2700110660272962,the heart pulmonary xxxx and mediastinum are within normal limits there is no pleural effusion or pneumothorax there is no focal air space opacity to suggest a pneumonia there are tspine osteophytes the xxxx of,[u'cardiomegaly is present the upper lobe pulmonary vascularity appears mildly prominent consistent with pulmonary venous hypertension the lungs are free of focal airspace disease no pleural effusion or pneumothorax is seen there is eventration of the right hemidiaphragm bony changes of renal osteodystrophy are noted cardiomegaly and mild vascular prominence .']
63,0.5643211498894547,0.5291726849823305,0.5026301666729786,0.476964115898139,3.0223694644863897,0.33964137100735736,0.48557213930348253,the cardiomediastinal silhouette is within normal limits for size and contour the lungs are normally inflated without evidence of focal airspace disease pleural effusion or pneumothorax no acute bone abnormality,[u'heart size upper limits of normal but stable tortuous aorta the lungs are normally inflated without evidence of focal airspace disease pleural effusion or pneumothorax osseous structures are within normal limits for patient age .']
64,0.26381659049061146,0.134520594292011,8.646704004586977e-07,2.2156560922952603e-09,0.1410871998517218,0.12112194536684757,0.17630057803468208,there are mild cardiomegaly and mediastinal contours are unchanged lungs are clear without focal consolidation no pneumothorax or pleural effusion degenerative changes of the thoracic spine,[u'no focal consolidation suspicious pulmonary opacity or definite pleural effusion heart size and pulmonary vascularity within normal limits stable mediastinal contour calcified hilar lymph xxxx visualized osseous structures unremarkable .']
65,0.6080855684790824,0.4074534476731986,0.287630894274425,0.1859957770383421,0.5965160991006477,0.28954661135566667,0.3541364296081277,the heart is normal in size and contour the lungs are clear without evidence of infiltrate there is no pneumothorax or effusion,[u'the lungs are clear there is no pleural effusion or pneumothorax the heart and mediastinum are normal the skeletal structures are normal .']
66,0.22447903002068564,3.3042418544026183e-09,8.336172611034615e-12,4.288074333951293e-13,0.09579492803971952,0.14652014652014653,0.17511961722488037,normal heart size clear lungs no pneumothorax pleural effusion or focal airspace disease,[u'the heart is normal in size the mediastinum is unremarkable granulomatous sequela are noted the lungs are otherwise clear .']
67,0.3717282598294023,0.2887002116191922,0.21467697783097117,0.15804450253163613,0.16155893297722712,0.22167172795217996,0.48740012292562995,normal heart size and mediastinal contours no focal airspace consolidation no pneumothorax or pleural effusion visualized xxxx are unremarkable,[u'heart size and mediastinal contours appear within normal limits pulmonary vascularity is within normal limits no focal consolidation suspicious pulmonary opacity pneumothorax or definite pleural effusion visualized osseous structures appear intact .']
68,0.22019069252835932,0.10771719660993347,0.06918699059367449,1.0077232533649313e-05,0.016189176340311508,0.1353669869662793,0.26255380200860834,the heart is normal in size the mediastinum is unremarkable the lungs are clear,[u'heart size and cardiomediastinal contours are normal aorta is mildly tortuous lungs are clear without focal airspace opacity pleural effusion or pneumothorax mild degenerative changes in the spine .']
69,0.4223411020181275,0.2630513960927444,0.15759385133889872,0.10350937016784705,0.7634872705014555,0.20211339660057392,0.26368876080691644,low lung volumes with bronchovascular crowding the cardiac silhouette is normal limits no focal consolidation pneumothorax or pleural effusion seen the right apex is again noted no acute osseous abnormalities,[u'there extremely low lung volumes there is right basilar opacity there is no pneumothorax there is no large pleural effusion cardiac silhouette and mediastinal contours are within normal limits low lung volumes with right basilar atelectasis .']
70,0.38463987531122895,0.31841925676763994,0.2744894693039048,0.22923124965990735,0.9312018130206705,0.22929121593633087,0.5527182866556837,the heart is normal in size the mediastinum is unremarkable the lungs are clear,[u'the heart is normal size the mediastinum is unremarkable there is no pleural effusion pneumothorax or focal airspace disease the xxxx are unremarkable .']
71,0.2916666666545139,0.19504737439306988,0.12002890534307711,1.693984999796846e-05,0.19407962676763274,0.12185882521471683,0.1799410029498525,the heart is normal in size the mediastinum is unremarkable mild blunting of the xxxx xxxx scarring or atelectasis the lungs are otherwise clear,[u'stable cardiomediastinal silhouette tortuous aorta the lungs are clear bilaterally no large pleural effusion or pneumothorax the xxxx are intact .']
72,0.017255647667431206,0.012662183658274064,0.009309901653181227,0.0068604558999908255,6.642213071356304e-16,0.05418443525244388,0.13980137509549273,the heart is normal in size the mediastinum is unremarkable the lungs are clear,[u'lobulated right middle lobe mass measuring x cm increased in size compared to prior study most compatible with neoplasm otherwise the lungs are clear without focal consolidation no pneumothorax or pleural effusion cardiomediastinal silhouette within normal limits interval enlargement of right middle lobe mass highly suspicious for malignancy recommend ct of the chestabdomen with intravenous contrast for further evaluation otherwise clear lungs .']
73,0.3199999999872001,0.16329931617887722,0.10505425132095153,1.5151462449671721e-05,0.1327166664407779,0.16657107530448367,0.2721189591078067,stable appearance of the chest xxxx sternotomy xxxx no focal consolidation pneumothorax or pleural effusion heart size is within normal limits no acute osseous abnormalities,[u'the lungs are clear heart size is normal no pneumothorax there are endplate changes within the spine clear lungs .']
74,0.39999999998666674,0.20341905107934563,0.11390472475032029,1.5295559336991324e-05,0.44918094433167755,0.18519767508526552,0.27201783723522854,the cardiomediastinal silhouette and pulmonary vasculature are within normal limits in size the lungs are clear of focal airspace disease pneumothorax or pleural effusion there are no acute bony findings,[u'heart size within normal limits stable mediastinal and hilar contours left hemidiaphragm eventration no focal alveolar consolidation no definite pleural effusion seen no typical findings of pulmonary edema .']
75,0.1470829382947414,1.7065131744689162e-09,3.967766718398737e-12,1.9552915024776949e-13,0.002397731812698716,0.08561872909698998,0.19830949284785437,the heart is normal in size the mediastinum is unremarkable the lungs are clear,[u'normal heart size stable unfolding the thoracic aorta no focal air space consolidation no pleural effusion or pneumothorax stable calcified granuloma in the left lower lobe visualized osseous structures are unremarkable appearance .']
76,0.32571952871899656,0.22128284516394464,0.13852537897649975,1.9918988794271418e-05,0.2505802644799823,0.18198724714292358,0.34205607476635513,the heart is normal in size the mediastinum is unremarkable the lungs are clear,[u'heart size and mediastinal contour are normal pulmonary vascularity is normal lungs are clear no pleural effusions or pneumothoraces .']
77,0.96078943907546,0.9607894390746593,0.9607894390738123,0.960789439072914,9.717723805848868,0.674394207536887,0.9769378603459321,the heart size and mediastinal silhouette are within normal limits for contour the lungs are clear no pneumothorax or pleural effusions the xxxx are intact,[u'the heart size and mediastinal silhouette are within normal limits for contour the lungs are clear no pneumothorax or pleural effusions the xxxx are intact .']
78,0.3688630529112405,0.2466712113735333,0.17376459394672752,0.13332473625061966,0.11946184819564146,0.17004960045753817,0.3279569892473118,the heart is normal in size and contour there is no focal air space opacity no pleural effusion or pneumothorax the lungs are clear,[u'cardiomediastinal silhouette are normal in size and contour again demonstrated are biapical bullous emphysematous changes no focal consolidation pneumothorax or pleural effusion mild multilevel degenerative changes of the thoracic spine no acute cardiopulmonary abnormality .']
79,0.27906976743537054,2.577696311071676e-09,5.452050641131241e-12,2.522928327141442e-13,0.10872464478277369,0.13341274568195358,0.13266637668551545,there is a moderate left basilar airspace opacity with a left pleural effusion the heart is normal size and contour there is tortuosity of the thoracic aorta stable left hemidiaphragm there is a small right pleural effusion no acute cardiopulmonary disease is seen,[u'in the interval consolidation and atelectasis have developed in the right lower lobe costophrenic xxxx blunted on the right left lung clear heart size normal left lower lobe airspace disease consistent with pneumonia .']
80,0.13333333332888891,2.1442250696028833e-09,5.47596801090444e-12,2.7925742928429695e-13,0.0019181736875767447,0.10961978184321691,0.13800904977375564,the lungs are clear bilaterally specifically no evidence of focal consolidation pneumothorax or pleural effusion cardio mediastinal silhouette is unremarkable visualized osseous structures of the thorax are without acute abnormality,[u'low lung volumes xxxx normal heart size no pneumothorax no large effusion no focal infiltrate .']
81,0.22848362552124732,0.12772622960267227,7.399615376756485e-07,1.8009429767478826e-09,0.01027642337313476,0.09840372713944766,0.27057663873829474,the heart is normal in size the mediastinum is stable atherosclerotic calcifications of the aorta is seen there is a small pleural effusion is noted,[u'the trachea is midline cardiomediastinal silhouette is normal the there are xxxx opacities in the left lower lobe of the lung which are most xxxx dependent atelectasis there is no pneumothorax visualized bony structures reveal no acute abnormalities .']
82,0.36666666665444453,0.2514326764768464,0.16528691241294277,0.11372027709677378,0.3352876264005591,0.20055666686350418,0.34014869888475835,the lungs are clear bilaterally specifically no evidence of focal consolidation pneumothorax or pleural effusion cardio mediastinal silhouette is unremarkable visualized osseous structures of the thorax are without acute abnormality,[u'the cardiomediastinal silhouette is normal in size and contour no focal consolidation pneumothorax or large pleural effusion negative for acute displaced rib fracture .']
83,0.2998596588322189,0.17965932218869343,0.12346324815589364,1.8600679493730537e-05,0.14784621440078266,0.17638372268556174,0.2949709864603482,the heart is normal in size the mediastinum is unremarkable the lungs are clear,[u'heart size normal lungs are clear xxxx are normal no pneumonia effusions edema pneumothorax adenopathy nodules or masses .']
84,0.4916083143017386,0.3194403425126833,0.19553029419462006,2.3224743963977923e-05,0.6000854624671091,0.2972413886980105,0.32906271072151044,no focal lung consolidation no pneumothorax or pleural effusion normal heart size and pulmonary vascularity bony structures appear intact,[u'cardiac size mediastinal contour and pulmonary vascularity are within normal limits no focal consolidation suspicious pulmonary opacity pleural effusion or pneumothorax the visualized osseous structures appear intact .']
85,0.2949408202320861,0.09076176328251147,6.215175647671756e-07,1.6445797434672361e-09,0.041650195238592085,0.12399167442958786,0.19416445623342177,the cardiomediastinal silhouette is normal in size and contour right lung base no focal consolidation pneumothorax or large pleural effusion negative for acute bone abnormality,[u'lung volumes are mildly decreased the cardiac silhouette and pulmonary vascularity are normal there is bilateral lower lobe xxxx airspace opacities compatible with discoid atelectasis there is no evidence of pleural effusion or pneumothorax .']
86,0.11233224101807221,0.07289078310692414,0.05099712743522723,7.694637392609624e-06,0.0017087891119886367,0.05174963064220647,0.1358574610244989,the heart and lungs have xxxx xxxx in the interval both lungs are clear and expanded heart and mediastinum normal,[u'the lungs are clear bilaterally specifically no evidence of focal consolidation pneumothorax or pleural effusion cardio mediastinal silhouette is unremarkable visualized osseous structures of the thorax are without acute abnormality no acute displaced rib fractures .']
87,0.2352941176401385,0.08444006618162872,6.062462295166369e-07,1.6373682487936863e-09,0.059073219367104975,0.13274116253181137,0.18176400476758045,the heart is normal in size the mediastinum is unremarkable mild blunting of the xxxx costophrenic xxxx are noted the lungs are otherwise clear without evidence of infiltrate there is no pneumothorax or effusion,[u'right lower lobe xxxx calcified granuloma heart size within normal limits no pleural effusions no evidence of pneumothorax degenerative changes thoracic spine .']
88,0.29629629628532245,0.21350420506538995,0.12216804360518721,1.660219092499284e-05,0.11317319643834216,0.16811089037009633,0.15492063492063493,heart size within normal limits stable mediastinal and hilar contours no focal alveolar consolidation no definite pleural effusion seen no typical findings of pulmonary edema no pneumothorax,[u'lungs are clear bilaterally with no focal infiltrate pleural effusion or pneumothoraces cardiomediastinal silhouette is within normal limits xxxx and soft tissues are unremarkable .']
89,0.017589642559751237,3.332642500961404e-10,9.124729569114068e-13,4.8795837804334e-14,1.2797108218054921e-09,0.02025879548492594,0.057710501419110695,the heart is normal in size the mediastinum is unremarkable the lungs are clear,[u'rotated with low lung volumes question left atrial enlargement xxxx appreciated on lateral view there is no focal consolidation there are no xxxx of a large pleural effusion there is no pneumothorax there is no acute bony abnormality seen question left atrial enlargement xxxx appreciated on lateral view .']
90,0.24934792880616588,0.16796901070690648,0.10417724273393385,1.4826952179252223e-05,0.23297198399457045,0.11240688649526513,0.26406926406926406,heart size normal lungs are clear xxxx are normal no pneumonia effusions edema pneumothorax adenopathy nodules or masses,[u'heart size normal no pneumothorax large pleural effusion or focal airspace disease bony structures appear intact calcified right hilar nodules consistent with chronic granulomatous disease .']
91,0.9672161004175249,0.967216100416969,0.9672161004163867,0.9672161004157757,9.66370847155169,0.6875087304026954,0.9807073954983923,the cardiomediastinal silhouette and pulmonary vasculature are within normal limits in size the lungs are clear of focal airspace disease pneumothorax or pleural effusion there are no acute bony findings,[u'the cardiomediastinal silhouette and pulmonary vasculature are within normal limits in size the lungs are clear of focal airspace disease pneumothorax or pleural effusion there are no acute bony findings .']
92,0.44999999997750006,0.3077935056097516,0.21915874167287905,2.8051550318641077e-05,0.46501218096723274,0.30184428695852716,0.31508264462809915,normal heart size and mediastinal contours no focal airspace consolidation no pleural effusion or pneumothorax visualized osseous structures are unremarkable,[u'lungs are clear without focal consolidation effusion or pneumothorax normal heart size .']
